{
  "id": "FLOW-billing-stripe-webhook",
  "title": "Stripe billing webhook: verify, record receipt, forward invoice events to SQS, fork reconciliation",
  "commit": "fd790d7",
  "domain": "billing",
  "entrypoint": {
    "id": "EP-9df71973",
    "kind": "HTTP",
    "target": "POST /api/billing/webhooks/stripe",
    "symbol": "BillingWebhookController.receiveStripeEvent"
  },
  "hops": [
    {
      "order": 1,
      "symbol": "BillingWebhookController.receiveStripeEvent",
      "evidence": {
        "file": "src/main/java/com/acme/care/billing/web/BillingWebhookController.java",
        "line": 27,
        "snippet": "    @PostMapping(path = ApiPaths.Billing.WEBHOOK, consumes = \"application/json\")"
      },
      "tx": null,
      "thread": "HTTP request thread",
      "notes": "Controller has no @Transactional. Takes the Stripe-Signature header and the raw String body."
    },
    {
      "order": 2,
      "symbol": "StripeWebhookService.handle",
      "evidence": {
        "file": "src/main/java/com/acme/care/billing/web/BillingWebhookController.java",
        "line": 31,
        "snippet": "            webhookService.handle(signature, payload);"
      },
      "tx": "T1",
      "thread": "HTTP request thread",
      "notes": "Called on the injected StripeWebhookService bean (a concrete class, not an interface), so it goes through the Spring proxy and @Transactional applies."
    },
    {
      "order": 3,
      "symbol": "StripeWebhookService.verify",
      "evidence": {
        "file": "src/main/java/com/acme/care/billing/service/StripeWebhookService.java",
        "line": 63,
        "snippet": "            return Webhook.constructEvent(payload, signature, webhookSecret);"
      },
      "tx": "T1",
      "thread": "HTTP request thread",
      "notes": "Private method, self-invoked. Wraps the Stripe SDK's SignatureVerificationException in InvalidSignatureException (line 65). Runs after T1 has begun, before any write."
    },
    {
      "order": 4,
      "symbol": "CustomerReconciliationService.reconcileCustomer",
      "evidence": {
        "file": "src/main/java/com/acme/care/billing/service/StripeWebhookService.java",
        "line": 56,
        "snippet": "        executor.submit(() -> reconciliationService.reconcileCustomer(event.getAccount(), event.getId()));"
      },
      "tx": null,
      "thread": "billingExecutor (ASYNC_FORK order 4)",
      "notes": "T1 does not propagate to the pool thread. No class named CustomerReconciliationService exists in the repository, so its body and side effects are unknown."
    }
  ],
  "boundaries": [
    {
      "order": 1,
      "type": "TX_BEGIN",
      "symbol": "StripeWebhookService.handle",
      "evidence": {
        "file": "src/main/java/com/acme/care/billing/service/StripeWebhookService.java",
        "line": 45,
        "snippet": "    @Transactional"
      },
      "target": null,
      "tx": "T1",
      "durable": null,
      "notes": "Default attributes: REQUIRED propagation, rollback on RuntimeException and Error only. The caller has no transaction, so T1 is new. The transaction manager bean was not inspected."
    },
    {
      "order": 2,
      "type": "DB_WRITE",
      "symbol": "EventReceiptRepository.save",
      "evidence": {
        "file": "src/main/java/com/acme/care/billing/service/StripeWebhookService.java",
        "line": 50,
        "snippet": "        eventReceiptRepository.save(receipt);"
      },
      "target": "billing_event_receipt",
      "tx": "T1",
      "durable": false,
      "notes": "Inherited JpaRepository.save; the repository declares no custom save. The entity uses @GeneratedValue IDENTITY (EventReceipt.java:17). Insert of provider_event_id, event_type, payload (jsonb) and received_at, durable only when T1 commits. handle() does not call findByProviderEventId (EventReceiptRepository.java:9) first."
    },
    {
      "order": 3,
      "type": "MESSAGE_SEND",
      "symbol": "SqsTemplate.send",
      "evidence": {
        "file": "src/main/java/com/acme/care/billing/service/StripeWebhookService.java",
        "line": 53,
        "snippet": "            sqsTemplate.send(invoiceQueue, payload);"
      },
      "target": "${care.billing.invoice-queue:care-invoice-events}",
      "tx": "T1",
      "durable": true,
      "notes": "Sent only when event.getType() starts with \"invoice.\" (line 52). Runs inside T1's method scope but before T1 commits; SqsTemplate is not a JPA transactional resource. Sends the raw webhook payload."
    },
    {
      "order": 4,
      "type": "ASYNC_FORK",
      "symbol": "ExecutorService.submit",
      "evidence": {
        "file": "src/main/java/com/acme/care/billing/service/StripeWebhookService.java",
        "line": 56,
        "snippet": "        executor.submit(() -> reconciliationService.reconcileCustomer(event.getAccount(), event.getId()));"
      },
      "target": "billingExecutor",
      "tx": "T1",
      "durable": false,
      "notes": "billingExecutor is Executors.newFixedThreadPool(4) (BillingInfrastructureConfig.java:15): an in-memory queue, not Spring-managed. The returned Future is discarded. Submitted before T1 commits, so the task can start before the receipt row is committed."
    },
    {
      "order": 5,
      "type": "TX_COMMIT",
      "symbol": "StripeWebhookService.handle (proxy return)",
      "evidence": {
        "file": "src/main/java/com/acme/care/billing/web/BillingWebhookController.java",
        "line": 31,
        "snippet": "            webhookService.handle(signature, payload);"
      },
      "target": "billing_event_receipt",
      "tx": "T1",
      "durable": true,
      "notes": "T1 commits in the transactional proxy when handle() returns normally, after the SQS send and the executor submit."
    },
    {
      "order": 6,
      "type": "RESPONSE",
      "symbol": "BillingWebhookController.receiveStripeEvent",
      "evidence": {
        "file": "src/main/java/com/acme/care/billing/web/BillingWebhookController.java",
        "line": 34,
        "snippet": "            return ResponseEntity.badRequest().build();"
      },
      "target": "HTTP 400",
      "tx": null,
      "durable": null,
      "notes": "Rejection path: InvalidSignatureException caught at line 32. The exception leaves handle(), so T1 ends without commit; no write has happened by then."
    },
    {
      "order": 7,
      "type": "RESPONSE",
      "symbol": "BillingWebhookController.receiveStripeEvent",
      "evidence": {
        "file": "src/main/java/com/acme/care/billing/web/BillingWebhookController.java",
        "line": 36,
        "snippet": "        return ResponseEntity.ok().build();"
      },
      "target": "HTTP 200",
      "tx": null,
      "durable": null,
      "notes": "Acceptance path, reached after T1 has committed. Other exceptions from handle() are not caught here."
    }
  ],
  "acknowledgement": {
    "description": "HTTP 200 to the payment provider at BillingWebhookController line 36, after StripeWebhookService.handle has returned and T1 has committed. Before it: the receipt insert (committed), the SQS send for invoice.* events (accepted by the broker) and the reconciliation task (only queued in the in-memory billingExecutor, possibly unfinished).",
    "evidence": {
      "file": "src/main/java/com/acme/care/billing/web/BillingWebhookController.java",
      "line": 36,
      "snippet": "        return ResponseEntity.ok().build();"
    },
    "durableBefore": false
  },
  "stoppedAt": [
    {
      "symbol": "com.stripe.net.Webhook.constructEvent",
      "reason": "Stripe SDK library call for signature verification; not repository code."
    },
    {
      "symbol": "io.awspring.cloud.sqs.operations.SqsTemplate.send",
      "reason": "Known framework boundary (MESSAGE_SEND); the queue consumer is a separate flow."
    },
    {
      "symbol": "CustomerReconciliationService.reconcileCustomer",
      "reason": "No source for this type in the repository (absent from the atlas and from Grep)."
    }
  ],
  "sourceBudget": {
    "filesOpened": 5,
    "limit": 12,
    "expansions": []
  },
  "openQuestions": [
    "CustomerReconciliationService is referenced (StripeWebhookService.java:27) but not defined in the repository: what does reconcileCustomer write or call, and is it transactional?",
    "InvalidSignatureException is imported from com.acme.care.billing.service but not defined in the repository: is it unchecked? This decides whether T1 rolls back on that path.",
    "Is there a unique constraint on billing_event_receipt.provider_event_id? No DDL or migration was inspected, and handle() does not check findByProviderEventId before inserting.",
    "How do exceptions other than InvalidSignatureException that leave handle() (DB, SQS, executor rejection) map to an HTTP status? No @ControllerAdvice was inspected.",
    "Configured values of care.billing.invoice-queue and care.billing.stripe.webhook-secret were not inspected.",
    "Which PlatformTransactionManager backs @Transactional? Not inspected; a single JPA transaction manager is assumed.",
    "Only one entry point matched 'webhook' (EP-9df71973). EP-8e45afc0 (Kafka paymentEventsContainer, BillingKafkaConfig.java:23) also receives payment events but is not an HTTP provider callback, so it was not traced."
  ]
}
